SY-56,BIRCHVILLE POND NR FRENCH CORRAL CA,3.91937E+14,39.326837,-121.151622,2.46,1.33,0.04,0.02,9.35,0.03,0.03,0.03,0.08,0.72,0.15
SY-57,FRENCH CORRAL C NR BRIDGEPORT CA,3.91744E+14,39.295556,-121.182778,6.58,4.52,0.09,0.07,0,0,0,0,0,0,0
SY-58,KENTUCKY RAVINE NR FRENCH CORRAL CA,3.91726E+14,39.290556,-121.198889,1.25,1.12,0.06,0.07,0,0,0,0,0,0,0
SY-59,POORMAN C AB ANCHO ERIE MINE DRAIN NR WASHINGTON,3.92515E+14,39.420833,-120.759722,0,0,0,0,0,0,0.05,0.03,0,0.25,0.07
TR-01,EF TRINITY R A HORSE HEAVEN MDW NR MT SHASTA CA,4.10928E+14,41.15765,-122.45446,1.49,1.2,0.06,0.06,143.34,0.79,0.04,0.03,0,0,0
TR-02,TAMARACK C A EF TRINITY R NR MT SHASTA CA,4.10916E+14,41.154316,-122.461682,1.36,0.57,0.02,0.02,22.61,0.03,0.02,0.02,0,0,0
TR-03,CROW C AB CONFLUENCE OF EF TRINITY R NR TRINITY CE,4.1074E+14,41.154316,-122.461682,4.51,2.01,0.07,0.07,573.89,0.27,0.08,0.07,0,0,0
TR-04,EF TRINITY R US ALTOONA MINE DRAIN NR CASTELLA CA,4.10736E+14,41.126641,-122.536944,0,0,0,0,0,0,0.1,0.05,0.16,0,0
TR-05,ALTOONA MINE DR A EF TRINITY R NR TRINITY CENTER,4.10734E+14,41.125982,-122.538907,157.32,76.13,0.11,0.05,48608.64,0.79,0.46,0.32,0.34,0,0
TR-06,EF TRINITY R BL ALTOONA MINE DR NR TRINITY CENTER,4.10731E+14,41.125148,-122.539463,2.35,1.9,0.02,0.02,1158.89,0.66,0.1,0.07,0.49,0,0
TR-07,ALTOONA MINE WETLANDS NR TRINITY CENTER CA,4.00502E+14,41.137038,-122.546975,0,0,0,0,0,0,1.1,0.13,0.53,0,0
TR-08,EF TRINITY R 1.2 MI BL DEVILS C NR TRINITY CENTER,4.10259E+14,41.049592,-122.598909,2.16,1.92,0.02,0.02,1872.3,0.01,0.09,0.07,0.21,0.74,0.16
TR-09,EF TRINITY R BL COUNTY RD 106 NR TRINITY CENTER CA,4.10031E+14,41.00848,-122.620298,2.68,1.71,0.02,0.02,1330.56,0.27,0.09,0.07,0.05,0,0
TR-10,EASTMAN GULCH NR LEWISTON CA,4.0452E+14,40.755423,-122.779189,0,0,0,0,0,0,0.05,0.06,0,0,0
TR-11,TRINITY R A BIG FLAT DAY USE AREA NR BIG BAR CA,4.04427E+14,40.740698,-123.216977,0.8,0.5,0.02,0.02,33.5,0.17,0.04,0.03,0,0,0
TR-12,TRINITY R A HAYDEN FLAT NR BIG BAR CA,4.04656E+14,40.782084,-123.346982,0.6,1.06,0.02,0.02,35.35,0.32,0.03,0.03,0,0,0
TR-13,CANYON C BL CONRAD GULCH NR JUNCTION CITY CA,4.04723E+14,40.789587,-123.056697,0.5,0.8,0.02,0.02,21.77,0.03,0.04,0.03,0,0,0
TR-14,EF OF NF TRINITY R .53 MI AB BARNEY GULCH,4.0494E+14,40.827642,-123.125867,1.76,1.8,0.04,0.02,33.53,0.03,0.08,0.03,0,0,0
TR-15,NEW R A DENNY CAMPGROUND NR DENNY CA,4.05557E+14,40.932358,-123.393933,0.7,0.6,0.02,0.02,54.8,0.05,0.03,0.03,0,0,0
TR-16,EASTMAN DREDGE POND NO 3 NR LEWISTON CA,4.04516E+14,40.754312,-122.778634,0,0,0,0,0,0,0,0.01,0,0,0
TR-17,EASTMAN DREDGE POND NO 2 NR LEWISTON CA,4.04509E+14,40.751944,-122.781667,0,0,0,0,0,0,0.02,0.01,0.02,0,0
TR-18,BOLTS HILL MINE TUNNEL INLET NR LEWISTON CA,4.04515E+14,40.753889,-122.806389,0,0,0,0,0,0,0.06,0.03,0,0,0
TR-19,BOLTS HILL MINE TUNNEL OUTLET NR LEWISTON CA,4.045E+14,40.753611,-122.807222,0,0,0,0,0,0,0.05,0.06,0.05,0,0
TR-20,BOLTS HILL MINE TUNNEL MIDPOINT NR LEWISTON CA,4.04507E+14,40.751667,-122.809444,0,0,0,0,0,0,0,0.05,0,0,0
TR-21,UNION HILL POND NR DOUGLAS CITY CA,4.03929E+14,40.657923,-122.933358,0,0,0,0,0,0,0,0.03,0,0,0
TR-22,UNION HILL GULCH NR DOUGLAS CITY CA,4.03927E+14,40.657368,-122.938359,0,0,0,0,0,0,0,0.04,0.05,0,0
TR-23,POISON GULCH POND NR WEAVERVILLE CA,4.0441E+14,40.735977,-123.006695,0,0,0,0,0,0,0.01,0.01,0,0,0
TR-24,SLATTERY POND NR WEAVERVILLE CA,4.04402E+14,40.733611,-123.020833,0,0,0,0,0,0,0,0.01,0,0,0
TR-25,HAS MINE TUNNEL INLET NR JUNCTION CITY CA,4.04345E+14,40.729167,-123.053056,0,0,0,0,0,0,0.04,0.05,0.03,0,0
TR-26,HOCKER FLAT MINE TUNNEL OUTLET NR JUNCTION CITY CA,4.045E+14,40.750833,-123.068333,0,0,0,0,0,0,0.02,0.02,0,0,0
TR-27,TRINITY R A E SIDE RD BR NR CARRVILLE CA,4.10311E+14,41.053611,-122.698056,0,0,0,0,0,0,0.04,0.06,0,0,0
TR-28,CARRVILLE POND NR CARRVILLE CA,4.10311E+14,41.053889,-122.700556,0,0,0,0,0,0,0,0.05,0,0,0
TR-29,COFFEE C A HWY 3 NR CARRVILLE CA,4.10502E+14,41.083889,-122.706389,0,0,0,0,0,0,0,0.02,0,0,0
TR-30,TRINITY R AB COFFEE C NR TRINITY CENTER CA,11523200,41.108889,-122.707222,0,0,0,0,0,0,0,0.01,0.03,0,0
