Station Map ID,USGS Station Name,USGS Station Number,Latitude (NAD83),Longitude (NAD83),Geometric Mean Water Mercury Unfiltered (ng/L),Geometric Mean Water Mercury Filtered (ng/L),Geometric Mean Water Methylmercury Unfiltered (ng/L),Geometric Mean Water Methylmercury Filtered (ng/L),"Geometric Mean Sediment Total Mercury, Dry (ng/g)","Geometric Mean Sediment Methylmercury, Dry (ng/g)","Geometric Mean Invertebrates Total Mercury, Wet (micrograms/g)","Geometric Mean Invertebrates Methylmercury, Wet (micrograms/g)","Geometric Mean Frogs Total Mercury, Wet (micrograms/g)","Geometric Mean Fish Total Mercury, Dry (mg/kg)","Geometric Mean Fish Total Mercury, Wet (mg/kg)"
AR-01,CANYON C BL GOLD RUN TUNNEL OUTLET NR GOLD RUN CA,3.90945E+14,39.161565,-120.840494,0,0,0,0,0,0,0.07,0.07,0,0,0
AR-02,CANYON C AB GOLD RUN TUNNEL OUTLET NR GOLD RUN CA,3.90945E+14,39.163509,-120.840216,0,0,0,0,0,0,0.06,0.05,0.05,0,0
AR-03,GOLD RUN TUNNEL OUTLET NR COLFAX CA,3.90945E+14,39.162398,-120.841605,36.12,3.52,0.02,0.02,9910.85,0.04,0.08,0.04,0.07,0,0
AR-05,GOLD RUN MINE POND NR INDIANA RAVINE NR GOLD RUN,3.90932E+14,39.158787,-120.847161,1.82,0.92,0.02,0.02,0,0,0.02,0.02,0,0,0
AR-06,KEYSTONE MINE TUNNEL OUTLET NR FORRESTHILLS CA,3.90305E+14,39.051389,-120.834167,2.9,0.15,0.02,0.02,389.67,0.04,0,0,0,0,0
AR-07,GLEESON DIGGINGS MAIN SLUICE CUT NR IOWA HILL CA,3.90455E+14,39.081843,-120.852715,22.23,1.38,0.16,0.04,895,0.35,0,0,0,0,0
AR-09,JUPITER MINE TUNNEL MIDWAY A SLUICE CUT,3.90629E+14,39.107953,-120.864938,36.46,8.42,0.02,0.02,3810,0.08,0,0,0,0,0
AR-10,AMERICAN R A FAIR OAKS CA,11446500,38.63546,-121.227726,1.11,0.59,0.02,0.03,0,0,0,0,0,0,0
AR-11,ALDER C POND A HWY 50 A NIMBUS CA,3.83809E+14,38.635738,-121.205503,4.13,1.84,0.4,0.13,485,2.56,0,0,0,0,0
AR-12,ALDER C A PRAIRIE CITY RD NR FOLSOM CA,3.83824E+14,38.639905,-121.155502,2.8,1.99,0.62,0.53,80.7,0.47,0,0,0,0,0
AR-13,ALDER C A FOLSOM BLVD NR NIMBUS CA,3.83816E+14,38.637682,-121.198281,2.87,2.03,0.19,0.19,158,1.15,0,0,0,0,0
AR-14,UNNAMED TRIB TO ALDER C NR FOLSOM CA,3.83834E+14,38.642682,-121.144946,1.3,0.9,0.08,0.11,128,1.53,0,0,0,0,0
AR-15,WILLOW C .1 MI US LK NATOMA NR FOLSOM CA,3.83859E+14,38.649626,-121.186336,3.26,1.51,0.19,0.17,456,2.45,0,0,0,0,0
AR-16,WILLOW C A E BIDWELL ST NR FOLSOM CA,3.84006E+14,38.668237,-121.147169,2.08,1.9,0.76,0.56,13.7,0.5,0,0,0,0,0
AR-17,WILLOW C A GOLF LINKS DRIVE NR FOLSOM CA,3.8403E+14,38.674904,-121.111057,0.9,0.7,0.1,0.1,49.3,0.63,0,0,0,0,0
AR-18,WILLOW C A LK NATOMA NR FOLSOM CA,3.83859E+14,38.649626,-121.191614,1.8,0.85,0.07,0.05,443,5.2,0,0,0,0,0
AR-19,WILLOW C A SIBLEY RD NR FOLSOM CA,3.83927E+14,38.657404,-121.16828,3.23,1.68,0.16,0.11,211,7.91,0,0,0,0,0
AR-20,HUMBUG C A E BIDWELL ST NR FOLSOM CA,3.8401E+14,38.669444,-121.151389,2.88,1.02,0.12,0.07,211,10.2,0,0,0,0,0
BR-60,SF GREENHORN C .8 MI AB GREENHORN C NR NEVADA CITY,3.91405E+14,39.234619,-120.892442,0,0,0,0,0,0,0,0,0.14,0,0
BR-01,BEAR R A HWY 20 NR EMIGRANT GAP CA,3.91823E+14,39.306289,-120.679102,0,0,0,0,0,0,0.05,0.04,0,0.31,0.07
BR-02,BEAR R BLW DRUM AFTERBAY NR DUTCH FLAT CA,3.91513E+14,39.25351,-120.776326,0,0,0,0,0,0,0,0.03,0,0,0
BR-03,BEAR R BL DUTCH FLAT AFTERBAY NR DUTCH FLAT CA,11421790,39.213509,-120.845217,17.01,2.66,0.04,0,0,0,0,0.02,0,0,0
BR-04,BEAR R AB GRVL PLNT AB STEEPHOLLOW C CHICAGO PARK,3.91038E+14,39.177119,-120.89133,15.36,6.38,0.05,0,441,0.17,0,0,0,0,0
BR-05,BEAR R A DOG BAR RD NR WEIMAR CA,3.90346E+14,39.062674,-121.003,0,0,0,0,0,0,0.2,0.09,0,0,0
BR-06,BEAR R BL WOLF C NR LUCAS HILL CA,3.90107E+14,39.018507,-121.173561,0,0,0,0,619.8,20.64,0.16,0.14,0.15,0,0
BR-07,BEAR R NR WHEATLAND CA,11424000,39.000173,-121.406624,0,0,0,0,0,0,0,0,0,0,0
BR-08,BEAR R A PLEASANT GROVE RD NR SHERIDAN CA,3.85904E+14,38.984339,-121.489126,0,0,0,0,0,0,0.1,0.08,0.08,0,0
BR-10,BOSTON MINE TUNNEL OUTLET NR GRASS VALLEY CA,3.91346E+14,39.229341,-120.903554,43.97,7.52,0.07,0.05,19876.14,1.87,0.55,0.16,0.14,0,0
BR-100,YOU BET SOUTH WEST-3 TUNNEL NR GOLD RUN CA,3.91147E+14,39.196286,-120.899386,9.28,7.88,0.16,0.02,152,0.45,0,0,0,0,0
BR-101,WALLOUPA MINE SOUTH DRAINAGE TUNNEL NR GOLD RUN CA,3.91132E+14,39.192119,-120.903275,8.33,2.3,0.04,0.02,2570,0.81,0,0,0,0,0
BR-102,WALLOUPA MINE EAST DRAINAGE TUNNEL NR GOLD RUN CA,3.91144E+14,39.195452,-120.907442,12.52,3.55,0.01,0,3000,0,0,0,0.02,0,0
BR-11,BOSTON MINE LOWER POND SITE 1 NR GRASS VALLEY CA,3.91343E+14,39.228507,-120.904665,0,0,0,0,242.23,0.03,0,0,0,0,0
BR-12,BOSTON MINE LOWER POND SITE 2 NR GRASS VALLEY CA,3.91343E+14,39.228507,-120.904665,0,0,0,0,144.7,0.04,0,0,0,0,0
BR-13,BOSTON MINE LOWER POND SITE 3 NR GRASS VALLEY CA,3.91343E+14,39.228507,-120.904665,0,0,0,0,227.58,0.22,0,0,0,0,0
BR-14,BOSTON MINE MIDDLE POND NR GRASS VALLEY CA,3.9134E+14,39.227674,-120.904109,0,0,0,0,0,0,0.15,0.16,0,0,0
BR-15,BOSTON MINE UPPER POND NR GOLD RUN CA,3.91336E+14,39.226563,-120.90522,0,0,0,0,148.59,0.03,0.14,0.12,0.06,0,0
BR-16,BOSTON MINE WETLANDS POND NR GRASS VALLEY CA,3.91343E+14,39.228508,-120.904109,16.25,2.45,0.16,0,92.7,3.4,0.03,0.05,0.05,0,0
BR-17,BOSTON MINE DRAINAGE AB TUNNEL INLET NR GOLD RUN,3.91344E+14,39.228785,-120.904665,0,0,0,0,39.8,0.01,0,0,0,0,0
BR-18,BOSTON MINE TUNNEL INFLOW A BULKHEAD NR GOLD RUN,3.91344E+14,39.228785,-120.903554,4.42,1.11,0.02,0.02,755.64,0.04,0,0,0,0,0
BR-19,BOSTON MINE 60 FT AB UPPER POND NR GOLD RUN CA,3.91333E+14,39.22573,-120.90522,0,0,0,0,143.29,0.91,0,0,0,0,0
BR-20,BUCKEYE FLAT MINE N DR TO GREENHORN C GRASS VALLEY,3.91446E+14,39.246008,-120.879386,243.38,198.42,0.3,0.02,12000,0.05,0,0.04,0,0,0
BR-21,BUCKEYE FLAT MINE POND DR .15 MI AB SF GREENHORN C,3.91416E+14,39.237674,-120.889942,9.4,10.05,0,0,873,5.4,0.11,0.07,0,0,0
BR-22,BUCKEYE FLAT MINE S DR TO SF GRNHRN C GRASS VALLEY,3.91415E+14,39.241563,-120.891609,90292.44,7042.73,9.11,0,150,1.9,0.16,0.18,0,0,0
BR-24,BUCKEYE FLAT MINE MAIN DR .45 MI AB GREENHORN C,3.91425E+14,39.240174,-120.895776,1.5,0.95,0,0,0,0,0.09,0.04,0.08,0,0
BR-25,BUCKEYE FLAT MINE UPPER DRAIN TO GREENHORN C,3.91453E+14,39.247952,-120.897721,4.14,1.12,0.03,0.03,0,0,0.09,0.04,0,0,0
BR-27,BUCKEYE FLAT MINE DR .1 MI AB GREENHORN C,3.91418E+14,39.23823,-120.902165,0,0,0,0,0,0,0.04,0.05,0.05,0,0
BR-28,BUCKEYE FLAT MINE DRAIN .06 MI AB GREENHORN C,3.91416E+14,39.237674,-120.902721,7.81,0,0,0.02,0,0,0,0,0,0,0
BR-30,GREENHORN C NR HEADWATERS NR SCOTTS FLAT RES,3.91657E+14,39.282398,-120.826329,9.32,5.1,0.06,0.02,0,0,0,0,0,0,0
BR-31,GREENHORN C BLW SAILOR FLAT DRAIN NR NEVADA CITY,3.91553E+14,39.264619,-120.892443,0,0,0,0,0,0,0,0.08,0,0,0
BR-32,GREENHORN C ABV SAILOR FLAT DRAIN NR NEVADA CITY,3.91542E+14,39.261563,-120.894665,0,0,0,0,0,0,0,0.04,0,0,0
BR-33,GREENHORN C BLW BUCKEYE DRAIN NR NEVADA CITY CA,3.91411E+14,39.236285,-120.903554,0,0,0,0,0,0,0,0.09,0,0,0
BR-34,GREENHORN C .3 MI AB BUCKEYE FORD NR NEVADA CITY,3.91434E+14,39.242674,-120.903832,27.1,3.7,0.02,0,0,0,0,0,0,0,0
BR-35,GREENHORN C BL GAS CYN NR GRASS VALLEY CA,3.91434E+14,39.242674,-120.90411,5.1,0,0,0.02,0,0,0,0,0,0,0
BR-36,GREENHORN C AB SF GREENHORN C NR NEVADA CITY CA,3.91401E+14,39.233507,-120.904387,0,0,0,0,0,0,0.13,0.08,0.07,0,0
BR-38,GREENHORN C BL SF GREENHORN C NR NEVADA CITY CA,3.91347E+14,39.229619,-120.907165,0,0,0,0,0,0,0.06,0.04,0.07,0,0
BR-39,GREENHORN C .2 MI BL THE NARROWS,3.91329E+14,39.224618,-120.91161,21.45,0,0,0.02,0,0,0.09,0.08,0,0,0
BR-40,GREENHORN C A YOU BET RD BRDG NR NEVADA CITY CA,3.91116E+14,39.187674,-120.941332,22.72,2.48,0.05,0.03,0,0,0,0.07,0.03,0,0
BR-41,LITTLE GREENHORN C A GREENHORN C,3.91119E+14,39.188507,-120.941333,3.73,0,0,0.02,0,0,0,0,0,0,0
BR-42,MISSOURI CYN C TRIB NR CHICAGO PARK CA,3.91253E+14,39.214619,-120.889386,0,0,0,0,0,0,0,0.18,0,0,0
BR-43,NF MF MISSOURI CYN NR CHICAGO PARK CA,3.91258E+14,39.216008,-120.889386,0,0,0,0,0,0,0.3,0.17,0.21,0,0
BR-44,MISSOURI CYN C 1.6 MI AB GREENHORN C NR CHICAGO PK,3.91254E+14,39.214897,-120.895498,0,0,0,0,0,0,0,0.08,0,0,0
BR-45,MISSOURI CYN C 1.2 MI AB GREENHORN C NR CHICAGO PK,3.91259E+14,39.216285,-120.900498,10.53,2.1,0.07,0.12,175,1.2,0.15,0.08,0.1,0,0
BR-46,COON HOLLOW C DR TUNNEL OUTLET NR DUTCH FLAT CA,3.91239E+14,39.21073,-120.901053,0,0,0,0,0,0,0,0.09,0,0,0
BR-48,POORE MINE UPPER POND NR GRASS VALLEY CA,3.91351E+14,39.230833,-120.909056,0,0,0,0,0,0,0.04,0.05,0,0,0
BR-49,POORE MINE LOWER POND NR GRASS VALLEY CA,3.91351E+14,39.230833,-120.909333,0,0,0,0,0,0,0.06,0.06,0,0,0
BR-50,POORE MINE C BL TUNNEL NR GRASS VALLEY CA,3.91343E+14,39.228507,-120.912721,4.56,0.75,0.02,0.11,0,0,0,0,0,0,0
BR-51,POORE MINE PIT LAKE NR GRASS VALLEY CA,3.91354E+14,39.231563,-120.912999,4.25,0.76,0.11,0.06,54.7,0.01,0,0,0,0,0
BR-52,POORE MINE TUNNEL EFFLUENT NR GRASS VALLEY CA,3.91347E+14,39.229618,-120.912999,13.79,0.43,0.09,0.02,0,0,0.05,0.03,0.06,0,0
BR-53,POORE MINE SEEP ABV GRND SLUICE NR GRASS VALLEY CA,3.91352E+14,39.231007,-120.913832,0,0.15,0,0,0,0,0,0.04,0.08,0,0
BR-55,POORE MINE GROUND SLUICE NR GRASS VALLEY CA,3.91351E+14,39.230729,-120.914665,0.85,0.15,0.02,0,0,0,0,0,0,0,0
BR-56,POORE MINE C AB TUNNEL NR GRASS VALLEY CA,3.91346E+14,39.229341,-120.915221,17.1,0.15,0.02,0,0,0,0,0.04,0.08,0,0
BR-57,HUNTS HILL DRAIN .03 MI AB GREENHORN C,3.91417E+14,39.237952,-120.904943,8.03,0,0,0.02,0,0,0,0,0,0,0
BR-58,GAS CANYON CR .05 MI AB GREENHORN C,3.91437E+14,39.243507,-120.904943,7.41,0,0,0.02,0,0,0,0,0,0,0
BR-61,SF GREENHORN C .7 MI AB GREENHORN C NR NEVADA CITY,3.91401E+14,39.233508,-120.895498,208.5,183,0.13,0.27,0,0,0.22,0.09,0.15,0,0
BR-62,SF GREENHORN C BLW BOSTON MINE NR NEVADA CITY CA,3.91351E+14,39.23073,-120.904109,11.59,6.4,0.02,0.02,0,0,0.3,0.23,0.16,0,0
BR-63,TOM JERRY MINE DRAINAGE POND NR NEVADA CITY CA,3.91628E+14,39.274341,-120.879943,32.4,16.2,0.02,0,0,0,0.03,0.03,0,0,0
BR-64,SAILOR FLAT E TRIB A MOUTH TO GREENHORN C,3.91611E+14,39.269619,-120.880776,8.33,0,0,0.02,0,0,0,0,0,0,0
BR-65,TOM JERRY MINE DR BL CONFLUENCE NR NEVADA CITY CA,3.91626E+14,39.27389,-120.88083,0,0,0,0,325,0.12,0,0,0,0,0
BR-66,TOM JERRY MINE DR A TUNNEL OUTLET NR NEVADA CITY,3.91627E+14,39.274063,-120.881054,14.15,5.91,0.22,0.89,894.61,0.72,0.13,0.11,0.09,0,0
BR-67,TOM JERRY MINE DR A TUNNEL INLET NR NEVADA CITY CA,3.91627E+14,39.274063,-120.881332,26.3,0,0.18,0,15900,74.2,0.07,0.02,0,0,0
BR-68,SAILOR FLAT MINE MAIN DR TO GREENHORN CR GULCH 03,3.91615E+14,39.27073,-120.888554,14.55,10,0.1,0.06,0,0,0,0,0,0,0
BR-69,SAILOR FLAT MINE MAIN DR GULCH 01 NR QUAKER HILL,3.9162E+14,39.272119,-120.890499,1160.34,74.19,0.89,0,5.96,0.02,0.04,0.06,0.04,0,0
BR-70,STARR PIT POND NR GRASS VALLEY CA,3.91327E+14,39.224063,-120.906332,0,0,0,0,0,0,0,0.04,0.06,0,0
BR-71,STARR MINE TUNNEL INFLOW NR GRASS VALLEY CA,3.91327E+14,39.224063,-120.906609,4.6,0.55,0.02,0,0,0,0,0,0,0,0
BR-72,STARR MINE TUNNEL MIDWAY NR GRASS VALLEY CA,3.91329E+14,39.224063,-120.906609,936.99,4.52,0.78,0,12100,9.5,0,0,0,0,0
BR-73,STARR MINE TUNNEL OUTLET NR GRASS VALLEY CA,3.9133E+14,39.224896,-120.910221,715.19,3.15,0.82,0.02,41000,4.1,0,0.03,0.09,0,0
BR-74,STARR MINE TUNNEL SW OUTLET NR GRASS VALLEY CA,3.91329E+14,39.224722,-120.910278,5.78,2.55,0.02,0.02,0,0,0,0,0,0,0
BR-75,POLAR STAR MINE PIT SUMP NR DUTCH FLAT CA,3.91245E+14,39.212398,-120.835217,0,0,0,0,23998.75,0.94,0,0,0,0,0
BR-76,POLAR STAR MINE TUNNEL INLET NR DUTCH FLAT CA,3.91243E+14,39.211842,-120.837439,41.5,1.55,0.01,0,0,0,0,0,0,0,0
BR-77,POLAR STAR MINE TUNNEL MIDWAY NR DUTCH FLAT CA,3.91245E+14,39.212398,-120.837995,208.5,7.1,0.05,0,7912.09,0.53,0,0,0,0,0
BR-78,POLAR STAR MINE TUNNEL DISCHARGE NR DUTCH FLAT CA,3.91247E+14,39.212953,-120.838273,208.95,14.74,0.09,0.02,6383.12,0.27,0,0.05,0.23,0,0
BR-79,POLAR STAR MINE BORROW PIT NR DUTCH FLAT CA,3.9125E+14,39.213787,-120.839939,2.92,0.8,0.14,0,0,0,0,0,0,0,0
BR-80,NF STEEPHOLLOW C NR BLUE CYN CA,3.91642E+14,39.278232,-120.780772,1.15,1.19,0.01,0,0,0,0,0.07,0.02,0.74,0.16
BR-81,REMINGTON HILL MINE MAIN DISCHARGE NR BLUE CYN CA,3.91643E+14,39.27851,-120.781605,2.2,1.81,0.01,0,0,0,0,0,0,0,0
BR-82,SE TRIB TO ROLLINS RES NR COLFAX CA,3.90815E+14,39.137396,-120.936609,0,0,0.02,0.02,0,0,0,0,0,0,0
BR-83,POORMAN C AB ROLLINS RES A YOU BET RD NR COLFAX CA,3.90951E+14,39.164063,-120.938276,2.4,0,0.02,0.02,0,0,0,0,0,0,0
BR-84,S TRIB TO ROLLINS RES NR COLFAX CA,3.90753E+14,39.131285,-120.94272,3.52,0,0.02,0.02,0,0,0,0,0,0,0
BR-85,BEAR R BL STEEPHOLLOW C NR CHICAGO PARK CA,3.91023E+14,39.173056,-120.903611,0,0,0,0,162,0.12,0,0,0,0,0
BR-86,NW TRIB TO ROLLINS RES NR BEAR RIVER PINES CA,3.91006E+14,39.168229,-120.959666,2.41,0,0.02,0.02,0,0,0,0,0,0,0
BR-88,SOUTHERN CROSS POND NICHOLS DIGGINGS NR DUTCH FLAT,3.91235E+14,39.20962,-120.840773,0,0,0,0,0,0,0,0,0.11,0,0
BR-89,SOUTHERN CROSS MINE TUNNEL MIDWAY NR DUTCH FLAT CA,3.91237E+14,39.210176,-120.84105,6.94,0.7,0.01,0,15300,0.62,0,0,0,0,0
BR-90,SOUTHERN CROSS MINE TUNNEL DISCHARGE NR DUTCH FLAT,3.91241E+14,39.211287,-120.841884,0,0,0,0,0,0,0,0.07,0.07,0,0
BR-91,STEEPHOLLOW C A LOWELL HILL BRDG NR NEVADA CITY CA,3.91146E+14,39.196008,-120.886052,20.62,2.9,0.07,0.02,104.61,0.13,0.1,0.09,0.09,0,0
BR-92,RJ MILES MINE PIT NR CHICAGO PARK CA,3.91037E+14,39.17694,-120.89583,0,0,0,0,396,,0,0,0,0,0
BR-93,STUMP CYN C NE NR DUTCH FLAT CA,3.91351E+14,39.230732,-120.822161,251.9,0.8,0.05,0,0,0,0,0,0,0,0
BR-94,STUMP CYN C NW NR DUTCH FLAT CA,3.9135E+14,39.230454,-120.824661,8.77,4.09,0.07,0,0,0,0,0,0,0,0
BR-95,YOU BET MINE OUTLET TO MAIN DRAIN TNNL NR GOLD RUN,3.91215E+14,39.204064,-120.890775,4.19,3.2,0.01,0,50,0.05,0,0.06,0,0,0
BR-96,YOU BET MINE INLET TO MAIN DRAIN TNNL NR GOLD RUN,3.91223E+14,39.206286,-120.891331,0.99,0.5,0.03,0,10,0.02,0,0.05,0.07,0,0
BR-97,WF WILCOX DR TUNNEL OUTLET NR CHICAGO PARK CA,3.91208E+14,39.202119,-120.894386,0,0,0,0,0,0,0.12,0.09,0.1,0,0
BR-98,WF WILCOX DR TUNNEL INLET NR CHICAGO PARK CA,3.9121E+14,39.202675,-120.894942,0,0,0,0,0,0,0.09,0.04,0,0,0
BR-99,YOU BET MINE SW DRAINAGE TUNNEL NR GOLD RUN CA,3.91144E+14,39.195452,-120.899108,6.2,3.3,0.01,0,539.91,0.41,0.2,0.1,0.1,0,0
DC-01,DEER C US SCOTTS FLAT RES A SAWMILL NR NEVADA CITY,3.91745E+14,39.29573,-120.887721,0,0,0,0,0,0,0.03,0.04,0,0,0
DC-02,DEER C AB SCOTTS FLAT RES NR NEVADA CITY CA,3.91731E+14,39.291841,-120.900222,1.99,0.9,0.01,0,0,0,0,0,0,0,0
DC-03,DEER C BL SCOTTS FLAT RES NR NEVADA CITY CA,3.91617E+14,39.271284,-120.933,6.12,2.5,0.01,0,0,0,0,0,0,0,0
DC-04,DEER C NR WILLOW VALLEY RD NR NEVADA CITY CA,3.91602E+14,39.267116,-121.003559,0,0,0,0,0,0,0.07,0.07,0,0,0
DC-05,DEER C BL DEER C FALLS NR ROUGH AND READY CA,3.9144E+14,39.244338,-121.13662,173.57,330,0,0.17,0,0,0.14,0.16,0,0,0
DC-06,SCOTTS FLAT RES NR NEVADA CITY CA,11418250,39.276111,-120.908889,0,0,0,0,0,0,0,0,0.06,0,0
DC-07,DEER C RES N SHORE NR NEVADA CITY CA,3.91615E+14,39.270833,-120.943611,0,0,0,0,0,0,0,0,0.05,0,0
DC-08,UNNAMED TRIB TO DEER C A SCOTTS FLAT RES BL CASCI,3.91728E+14,39.291007,-120.901333,19500,297.82,0.08,0,759.14,0.49,0,0,0,0,0
DC-09,LITTLE DEER C A PIONEER PARK NR NEVADA CITY CA,3.91534E+14,39.259338,-121.00967,0,0,0,0,0,0,0.13,0.13,0,0,0
LY-02,YUBA R A TIMBUTOO BEND NR SMARTSVILLE CA,3.91406E+14,39.235086,-121.321911,0,0,0,0,25.2,0.12,0,0,0,0,0
LY-03,YUBA R A HWY 20 NR SMARTSVILLE CA,3.91313E+14,39.220123,-121.333945,0,0,0,0,39.7,0.32,0,0,0,0,0
LY-04,YUBA R NR SMARTSVILLE CA,11419600,39.219337,-121.342738,1.81,0.8,0.02,0.02,94.3,1.06,0,0,0,0,0
LY-05,YUBA R A DAQUERRA PT NR BROWNS VALLEY CA,11420800,39.208225,-121.443019,9.48,0.8,0.02,0.02,391,6.09,0,0,0,0,0
LY-06,YUBA R NR HAMMONTON CA,3.91132E+14,39.191635,-121.482345,0,0,0,0,7.39,0.03,0,0,0,0,0
LY-07,YUBA R A HALLWOOD BLVD NR MARYSVILLE CA,3.91101E+14,39.183247,-121.509664,0,0,0,0,12.9,0.05,0,0,0,0,0
LY-08,YUBA R A MARYSVILLE CA,11421500,39.144337,-121.577465,1.27,0.8,0.08,0.05,61.87,0.59,0,0,0,0,0
LY-10,YUBA R A SOUTHERN PACIFIC RR BR A MARYSVILLE CA,3.9081E+14,39.136075,-121.58195,0,0,0,0,44.6,0.03,0,0,0,0,0
LY-11,WETLANDS POND NE OF S POND IN YUBA GOLDFIELDS,3.913E+14,39.216667,-121.396389,8.83,3.04,0.95,0.47,0,0,0.21,0.19,0.06,0,0
LY-12,LARGE POND E OF BIG SEEP IN YUBA GOLDFIELDS,3.91304E+14,39.217778,-121.398056,1.76,1,0.02,0.02,0,0,0.08,0.08,0.09,0.8,0.18
LY-13,LARGE POND W OF WETLANDS POND IN YUBA GOLDFIELDS,3.91258E+14,39.216111,-121.398056,2.09,1.16,0.26,0.1,0,0,0,0,0,0,0
LY-14,BIG SEEP SECTION 27 IN YUBA GOLDFIELDS,3.91305E+14,39.218056,-121.4,1.79,1.3,0.02,0.02,0,0,0.1,0.1,0,0.39,0.1
LY-15,T POND OUTLET IN YUBA GOLDFIELDS NR HAMMONTON CA,3.9125E+14,39.213889,-121.401667,2.12,0.96,0.02,0.02,0,0,0.05,0.04,0,1.1,0.23
LY-16,T POND IN YUBA GOLDFIELDS NR HAMMONTON CA,3.91259E+14,39.216389,-121.402222,2.32,0,0.02,0,0,0,0,0,0.16,0.59,0.14
MY-01,M YUBA R 0.6 MI BL MILTON DAM CA,11408550,39.521845,-120.583547,0.63,0.65,0.02,0.02,13.8,0.27,0,0,0,0,0
MY-02,M YUBA R NR ALLEGHANY CA,11408700,39.438508,-120.812166,0.5,0.3,0,0.02,134,8.06,0,0,0,0,0
MY-03,M YUBA R NR CAMPTONVILLE CA,11408850,39.416838,-120.952727,1.5,0.7,0,0.02,365,7.85,0,0,0,0,0
MY-04,M YUBA R NR NORTH SAN JUAN CA,11410000,39.394059,-121.084954,0.9,0.5,0.02,0.02,288,1.62,0,0,0,0,0
MY-05,CLEAR C NR NORTH SAN JUAN CA,3.92256E+14,39.382222,-121.099722,2.61,1.59,0.05,0.05,0,0,0,0,0,0,0
MY-06,SWEETLAND C AT SWEETLAND CA,3.92036E+14,39.343333,-121.124722,14.8,8.09,0.57,0.54,0,0,0,0,0,0,0
MY-07,M YUBA R AB COLGATE PH NR FRENCH CORRAL CA,3.9195E+14,39.330556,-121.187222,0.8,0.5,0.52,0.02,607,7.65,0,0,0,0,0
SNI-005,BELDEN PH A BELDEN CA,11403050,40.007386,-121.249409,0.05,0.04,0.06,0.01,8.81,0.07,0,0,0,0,0
SNI-006,SPANISH C BL CLEAR C NR KEDDIE CA,4.00129E+14,40.024722,-120.968611,0.14,0.27,0.01,0.03,17.2,0.19,0,0,0,0,0
SNI-007,SPANISH C NR EAST QUINCY CA,3.9583E+14,39.975,-120.906944,0.21,0.17,0.01,0.02,22.4,0.16,0,0,0,0,0
SNI-009,MF FEATHER R A SLOAT CA,11393000,39.85684,-120.719113,0.27,0.47,0.01,0.04,26.6,0.27,0,0,0,0,0
SNI-011,MF FEATHER R NR DELLEKER CA,3.94647E+14,39.779722,-120.529167,0.2,0.26,0.01,0.02,160,0.07,0,0,0,0,0
SNI-012,MERCED R AB BM1186 NR BRICEBURG CA,3.73637E+14,37.610211,-119.961566,0.03,0.22,0.01,0.01,9,0.66,0,0,0,0,0
SNI-013,MERCED R AB HWY 140 BRIDGE NR EL PORTAL CA,3.74017E+14,37.671318,-119.790728,0.08,0.06,0.01,0.01,1.4,0.11,0,0,0,0,0
SNI-040,MF COSUMNES R NR PIPI VLY NR OMO RANCH CA,3.83403E+14,38.5675,-120.455833,0.06,0.2,0.01,0.04,2.4,0.1,0,0,0,0,0
SNI-042,WOLF C NR LA BARR MEADOWS CA,3.90955E+14,39.165278,-121.061389,4.06,0.85,0.05,0.03,52.9,0.4,0,0,0,0,0
SNI-043,S WOLF C NR CHICAGO PARK CA,3.90722E+14,39.122778,-121.0275,0.69,0.48,0,0.04,381,1,0,0,0,0,0
SNI-045,SF DEER C NR WASHINGTON CA,3.91754E+14,39.298333,-120.846667,0.02,0.03,0.2,0.02,19.4,0.14,0,0,0,0,0
SNI-046,S YUBA R NR CISCO CA,11414000,39.321291,-120.564375,0.08,0.21,0.01,0.02,3.5,0.04,0,0,0,0,0
SNI-047,FORDYCE C AB LK SPAULDING NR EMIGRANT GAP CA,3.92122E+14,39.356111,-120.6125,0.33,0.31,0.01,0.01,9.1,0.07,0,0,0,0,0
SNI-048,MF COSUMNES R NR OMO RANCH CA,3.83632E+14,38.608889,-120.614167,0.03,0.17,0.01,0.02,3.7,0.04,0,0,0,0,0
SNI-051,SF FEATHER R NR LA PORTE CA,3.94034E+14,39.676111,-121.088333,0.03,0.16,0.01,0.01,31.2,0.12,0,0,0,0,0
SNI-052,SF FEATHER R 0.15 MI BL FORBESTOWN DAM CA,3.93302E+14,39.550556,-121.2125,0.09,0.15,0.01,0,4.6,0.06,0,0,0,0,0
SNI-053,MF FEATHER R A MILSAP BAR NR BRUSH CREEK CA,3.94237E+14,39.710278,-121.271667,0.53,0.28,0.01,0.01,9.1,0.08,0,0,0,0,0
SNI-054,MF FEATHER R ABV BRAY C NR SLOAT CA,3.95141E+14,39.861389,-120.846944,0.15,0.59,0.01,0.03,26.4,0.3,0,0,0,0,0
SNI-055,SF AMERICAN R A MOSQUITO RD NR PLACERVILLE CA,3.84634E+14,38.776111,-120.748056,0.05,0.04,0,0.01,4.5,0.15,0,0,0,0,0
SNI-056,SILVER FORK OF AMERICAN R NR KYBURZ CA,3.84526E+14,38.757222,-120.274722,0.03,0.35,0,0.02,1.1,0.03,0,0,0,0,0
SNI-057,NF OF MF AMERICAN R NR MICHIGAN BLUFF CA,3.9012E+14,39.022222,-120.721111,0.05,0.28,0,0.01,21.5,0.1,0,0,0,0,0
SNI-058,RUBICON R NR VOLCANOVILLE CA,3.85957E+14,38.999167,-120.723333,0.03,0.23,0,0.01,1.3,0.03,0,0,0,0,0
SY-01,OMEGA EAST SHAFT (TUNNEL VENT SHAFT) NR WASHINGTON,3.92022E+14,39.339343,-120.760217,4.01,0.15,0.11,0,0,0,0,0,0,0,0
SY-02,OMEGA EAST MAINSTEM NR WASHINGTON CA,3.9202E+14,39.337955,-120.761883,0,0,0,0,0,0,0,0,0,0,0
SY-03,OMEGA SOUTH TUNNEL NR WASHINGTON CA,3.9202E+14,39.338788,-120.761328,2.14,0.15,0.04,0,0,0,0,0,0,0,0
SY-04,OMEGA DR GULCH A SCOTCHMAN C NR WASHINGTON CA,3.92045E+14,39.345732,-120.776884,1.39,1.27,0.01,0,520,51,0,0.04,0,0,0
SY-05,SCOTCHMAN C AB OMEGA DR GULCH NR WASHINGTON CA,3.92042E+14,39.344899,-120.777162,1.1,0.94,0.01,0,73,0.86,0,0.06,0.04,0,0
SY-06,ALPHA MINE RED TUNNEL NR WASHINGTON,3.92023E+14,39.339621,-120.784384,5.68,1.2,0.01,0,7410,0,0,0,0,0,0
SY-07,ALPHA MINE MAIN DRAINAGE N ALPHA DIG NR WASHINGTON,3.92108E+14,39.352121,-120.784385,2.04,1.04,0.02,0,0,0,0,0,0,0,0
SY-08,SCOTCHMAN C A THE FALLS NR WASHINGTON CA,3.92116E+14,39.354343,-120.784662,1.96,0.5,0.08,0.04,45.06,1.23,0.08,0.06,0.07,0,0
SY-10,SCOTCHMAN C BL FALLS NR WASHINGTON CA,3.92119E+14,39.355176,-120.78494,1.85,0.9,0.04,0.05,44.11,0.34,0.08,0.07,0.07,0.56,0.12
SY-11,ALPHA MINE PIT NR WASHINGTON CA,3.92015E+14,39.337398,-120.785773,54.67,2.98,0.73,0,845,0,0,0,0,0,0
SY-12,ALPHA PIT MARSH NR WASHINGTON CA,3.92003E+14,39.334167,-120.785833,0,0,0,0,0,0,0.08,0.08,0.04,0,0
SY-13,ALPHA MINE PIT LK NR WASHINGTON CA,3.92007E+14,39.335176,-120.787162,3.66,1.22,0.02,0.03,67.31,0.08,0.07,0.06,0.03,0,0
SY-14,ANCHO ERIE DRAINAGE A TAILINGS DAM NR WASHINGTON,3.92512E+14,39.419899,-120.759663,0,0,0,0,22894.54,0.08,0,0,0,0,0
SY-15,ANCHO ERIE DRAINAGE A POORMAN C NR WASHINGTON CA,3.92512E+14,39.420833,-120.759722,53.19,3.53,0.03,0.03,8867.02,21.2,0.06,0.03,0,0,0
SY-16,POORMAN C BL ANCHO ERIE MINE DRAIN NR WASHINGTON,3.92513E+14,39.420176,-120.760218,0,0,0,0,3584.58,4.7,0.06,0.04,0,0.27,0.07
SY-17,GRIZZLY HILL TUNNEL OUTLET NR NORTH BLOOMFIELD CA,3.92014E+14,39.337116,-120.972171,31.9,13.34,0.12,0.06,729.21,0.11,0,0,0,0,0
SY-18,HUMBUG C AB LEDU MINE NR NORTH BLOOMFIELD CA,3.92152E+14,39.364444,-120.907222,0,0,0,0,0,0,0.11,0.09,0,0,0
SY-19,LEDU MINE TUNNEL DISCHARGE NR NORTH BLOOMFIELD CA,3.92151E+14,39.364062,-120.909113,3.68,0.8,0.02,0.02,150,0.12,0,0,0.07,0,0
SY-20,CRYSTAL HILL MINE POND NR NORTH BLOOMFIELD CA,3.92159E+14,39.366284,-120.912446,8.06,1.09,0.02,0.02,80.7,0.03,0,0,0,0,0
SY-21,MALAKOFF DIGGINGS FLD GREEN SHAFT DISCH NR BLMFLD,3.92152E+14,39.36434,-120.921614,1.54,7.4,0.01,0,0,0,0,0,0,0,0
SY-22,MALAKOFF DIGGINGS FLOODED RED SHAFT NR N BLMFLD,3.92155E+14,39.362167,-120.92215,208.98,0.42,0.37,0,88.32,0.01,0,0,0.05,0,0
SY-23,MALAKOFF DIGGINGS HILLER TNNL DISCH N BLOOMFIELD,3.92204E+14,39.367467,-120.920983,48.58,4.81,0.44,0,0,0,0,0,0,0,0
SY-24,MALAKOFF DIGGINGS POND NR NORTH BLOOMFIELD CA,3.92201E+14,39.366839,-120.924114,14.09,4.2,0.59,0,26900,30.8,0.12,0.13,0.18,0,0
SY-25,MALAKOFF DIGGINGS LK CITY TNNL DISCH NR N BLMFLD,3.92111E+14,39.352951,-120.924669,4.3,1.27,0.06,0,670,0,0,0.02,0.05,0,0
SY-26,HUMBUG C ABV FALLS NR NEVADA CITY CA,3.92057E+14,39.349062,-120.92578,0,0,0,0,0,0,0,0,0.04,0,0
SY-27,MALAKOFF DIGGINGS N BLMFLD TNNL DISCH NR N BLMFLD,3.92051E+14,39.348717,-120.926517,33.5,0.8,0.08,,190,0.12,0,0.03,0.09,0,0
SY-28,HUMBUG C BLW FALLS NR NEVADA CITY CA,3.9204E+14,39.34434,-120.928002,0,0,0,0,0,0,0,0,0.01,0,0
SY-29,RELIEF HILL DEEP BLUE TNNL OUTFLOW NR N BLOOMFIELD,3.92126E+14,39.357119,-120.85161,5.37,0.6,0.07,,150,0.18,0.06,0.07,0,0,0
SY-30,RELIEF HILL HYDR PIT MINE DR TNNL NR N BLOOMFIELD,3.92111E+14,39.352952,-120.854666,14.18,2.49,0.04,0.02,424,7.39,0.05,0.04,0,0,0
SY-31,RELIEF HILL UPPER POND NR NORTH BLOOMFIELD CA,3.9212E+14,39.355833,-120.855,0,0,0,0,70.03,0.29,0.04,0.03,0.05,0,0
SY-32,RELIEF HILL POND NR RELIEF HILL CA,3.92119E+14,39.355174,-120.857166,0.8,0.15,0.02,0.02,49.17,0.31,0,0,0,0,0
SY-33,LITTLE ROCK C .05 MI BL BLUE TENT RD NR NEVADA CITY CA,3.91726E+14,39.290556,-120.987222,12,1.87,0,0.03,200,0.88,0,0,0,0,0
SY-34,LITTLE ROCK C .1 MI BL BLUE TENT RD NR NEVADA CITY CA,3.91727E+14,39.290833,-120.9875,7.9,1.91,0.03,0,337,1.23,0,0,0,0,0
SY-35,LITTLE ROCK C .2 MI BL BLUE TENT RD NR NEVADA CITY CA,3.91728E+14,39.291111,-120.989444,12.9,1.74,0.15,0,23.6,0.08,0,0,0,0,0
SY-36,LITTLE ROCK C .9 MI BL BLUE TENT RD NR NEVADA CITY CA,3.91742E+14,39.295,-120.993889,3.77,1.63,0,0.08,178,1.5,0,0,0,0,0
SY-37,LITTLE ROCK C AB ROCK C NR NEVADA CITY CA,3.91759E+14,39.299722,-120.995,2.85,1.65,0.12,0,112,0.91,0,0,0,0,0
SY-38,ROCK C AB LITTLE ROCK C NR NEVADA CITY CA,3.91756E+14,39.298889,-120.995833,5.38,0.8,0.04,0,149,1.03,0,0,0,0,0
SY-39,ROCK C A ROCK C RD NR NEVADA CITY CA,3.9181E+14,39.302778,-121.004444,1.33,0.8,0,0.05,95.9,1.53,0,0,0,0,0
SY-40,LAKE VERA ROCK C ARM NR NEVADA CITY CA,3.91803E+14,39.300833,-121.024722,1.56,2.07,0.05,0,116,0.67,0,0,0,0,0
SY-41,LAKE VERA IN THALWEG NR DAM NR NEVADA CITY CA,3.91807E+14,39.301944,-121.027778,1.66,1,0,0,49.3,0.44,0,0,0,0,0
SY-42,LAKE VERA S SHORE NR NEVADA CITY CA,3.91802E+14,39.300556,-121.027778,1.62,0.97,0.05,0,54.4,0.09,0,0,0,0,0
SY-43,S YUBA R A EAGLE LAKES RD NR EMIGRANT GAP CA,3.91948E+14,39.329902,-120.57382,0,0,0,0,0,0,0.03,0.04,0,0,0
SY-44,S YUBA R AB LANGS CROSSING NR EMIGRANT GAP CA,3.91911E+14,39.319722,-120.656111,0.56,0.48,0.01,0.02,18.06,0.21,0,0,0,0,0
SY-45,S YUBA R BL POORMAN C NR WASHINGTON CA,3.92119E+14,39.355278,-120.813611,0.7,0.45,0.01,0.02,297.13,0.44,0,0,0,0,0
SY-46,S YUBA R A MISSOURI BAR NR NEVADA CITY CA,3.92025E+14,39.340278,-120.889444,1.37,0.5,0.02,0.02,392,26.2,0,0,0,0,0
SY-47,S YUBA R A EDWARDS CROSSING NR NEVADA CITY CA,3.91949E+14,39.330172,-120.984115,4.79,1.87,0.04,0,0,0,0.09,0.06,0.08,0,0
SY-48,S YUBA R AB PURDON CROSSING NR NEVADA CITY CA,3.91938E+14,39.327222,-121.041389,1.55,0.7,0.02,0.02,171,5.7,0,0,0,0,0
SY-50,S YUBA R A BRIDGEPORT CA,3.91734E+14,39.292778,-121.190278,0.7,0.8,0.02,0.02,406,9.03,0,0,0,0,0
SY-51,SAILOR FLAT MINE E DR GULCH NR NEVADA CITY CA,3.9194E+14,39.327672,-120.96467,13.65,0,1.1,0,0,0,0,0,0,0,0
SY-52,BLUE HOLE LK A SAILOR FLAT MINE NR NEVADA CITY CA,3.91937E+14,39.326839,-120.965781,1.3,0.85,0.01,0,7.1,0.03,0.07,0.06,0,0,0
SY-53,SAILOR FLAT MINE NR ENTERPRISE CR NR NEVADA CITY,3.91935E+14,39.326283,-120.967448,0,0,0,0,0,0,0,0.09,0,0,0
SY-54,SHADY C NR NORTH SAN JUAN CA,3.91922E+14,39.322778,-121.101389,73.4,9.86,0.12,0.1,0,0,0,0,0,0,0
SY-55,BIRCHVILLE MARSH NR FRENCH CORRAL CA,3.9193E+14,39.324892,-121.1519,0,0,0,0,0,0,0.01,0.02,0,0,0
