Station Map ID,USGS Station Name,USGS Station Number,Date,Time,Sample Type,Water Temperature (degrees Celsius),pH,Specific conductance (microsiemens/cm,Dissolved oxygen (mg/L),"Discharge, instantaneous, cubic feet per second",Barometric pressure (millimeters of mercury),"Dissolved oxygen, water, unfiltered, percent of saturation",Suspended sediment concentration (mg/L),"Suspended sediment, percentage finer than 0.063 mm"
AR-03,GOLD RUN TUNNEL OUTLET  NR COLFAX CA,3.90945E+14,2/21/2001,10:30,Environmental,ND,ND,ND,ND,ND,ND,ND,ND,58
AR-03,GOLD RUN TUNNEL OUTLET  NR COLFAX CA,3.90945E+14,11/6/2002,13:00,Environmental,7,6.1,940,9.8,ND,693,89,3,97
AR-05,GOLD RUN MINE POND NR INDIANA RAVINE NR GOLD RUN,3.90932E+14,2/21/2001,12:30,Environmental,ND,ND,ND,ND,ND,ND,ND,6,ND
AR-06,KEYSTONE MINE TUNNEL OUTLET NR FORRESTHILLS CA,3.90305E+14,11/6/2002,17:00,Environmental,11.9,6.9,160,8.6,1.5,688,88,4,70
AR-07,GLEESON DIGGINS MAIN SLUICE CUT NR IOWA HILL CA,3.90455E+14,2/7/2002,15:00,Environmental,7.6,4.2,384,2.5,ND,ND,ND,7,64
AR-09,JUPITER MINE TUNNEL MIDWAY A SLUICE CUT,3.90629E+14,2/7/2002,13:00,Environmental,7.1,6.1,210,7.2,ND,ND,ND,2,50
AR-10,AMERICAN R A FAIR OAKS CA,11446500,6/23/2003,11:30,Environmental,15,7.3,53,9.7,ND,757,97,ND,ND
AR-11,ALDER C POND A HWY 50 A NIMBUS CA,3.83809E+14,6/18/2003,16:40,Environmental,19,7.1,251,1.9,ND,ND,ND,ND,ND
AR-11,ALDER C POND A HWY 50 A NIMBUS CA,3.83809E+14,6/18/2003,17:50,Environmental,24.5,9.2,223,14.5,ND,ND,ND,ND,ND
AR-12,ALDER C A PRAIRIE CITY RD NR FOLSOM CA,3.83824E+14,6/19/2003,14:20,Environmental,24.5,7.7,388,7.5,1.1,754,91,ND,ND
AR-13,ALDER C A FOLSOM BLVD NR NIMBUS CA,3.83816E+14,6/19/2003,9:40,Environmental,20,7.5,329,6.6,1.2,751,74,ND,ND
AR-14,UNNAMED TRIB TO ALDER C NR FOLSOM CA,3.83834E+14,6/20/2003,12:10,Environmental,22,7.6,399,7,1,754,81,ND,ND
AR-15,WILLOW C .1 MI US LK NATOMA NR FOLSOM CA,3.83859E+14,6/19/2003,11:50,Environmental,21.1,7.7,260,9.1,7.2,753,104,ND,ND
AR-16,WILLOW C A E BIDWELL ST NR FOLSOM CA,3.84006E+14,6/20/2003,10:10,Environmental,19,7.8,306,8.3,1.5,749,91,ND,ND
AR-17,WILLOW C A GOLF LINKS DRIVE NR FOLSOM CA,3.8403E+14,6/20/2003,15:10,Environmental,22.5,7.6,303,7.9,0.75,750,93,ND,ND
AR-18,WILLOW C A LK NATOMA NR FOLSOM CA,3.83859E+14,6/18/2003,12:30,Environmental,15.5,9.7,59,14.8,ND,755,150,ND,ND
AR-18,WILLOW C A LK NATOMA NR FOLSOM CA,3.83859E+14,6/18/2003,13:10,Environmental,18.5,7.7,107,10.5,ND,755,113,ND,ND
AR-19,WILLOW C A SIBLEY RD NR FOLSOM CA,3.83927E+14,6/19/2003,16:00,Environmental,23,8.2,267,9.2,6.7,754,109,ND,ND
AR-20,HUMBUG C A E BIDWELL ST NR FOLSOM CA,3.8401E+14,6/20/2003,8:50,Environmental,19.5,7.6,262,6.3,3.4,752,70,ND,ND
BR-03,BEAR R BL DUTCH FLAT AFTERBAY NR DUTCH FLAT CA,11421790,9/30/1999,13:00,Environmental,16.3,7.2,59,ND,ND,ND,ND,80,100
BR-03,BEAR R BL DUTCH FLAT AFTERBAY NR DUTCH FLAT CA,11421790,10/1/1999,17:50,Environmental,16.2,7,56,ND,ND,ND,ND,19,100
BR-04,BEAR R AB GRVL PLNT AB STEEPHOLLOW C CHICAGO PARK,3.91038E+14,1/26/2000,11:50,Environmental,9,6.9,70,ND,ND,ND,ND,1,58
BR-06,BEAR R BL WOLF C NR LUCAS HILL CA,3.90107E+14,8/17/2000,12:30,Environmental,24,ND,ND,ND,ND,ND,ND,4,ND
BR-06,BEAR R BL WOLF C NR LUCAS HILL CA,3.90107E+14,10/14/2003,12:50,Environmental,ND,ND,ND,ND,ND,ND,ND,3,79
BR-06,BEAR R BL WOLF C NR LUCAS HILL CA,3.90107E+14,10/15/2003,10:15,Environmental,ND,ND,ND,ND,ND,ND,ND,4,89
BR-07,BEAR R NR WHEATLAND CA,11424000,6/23/1999,11:00,Environmental,25.4,7.7,85,11.4,35,757,140,ND,ND
BR-08,BEAR R A PLEASANT GROVE RD NR SHERIDAN CA,3.85904E+14,3/19/2003,11:30,Environmental,12,7.5,78,ND,ND,765,ND,ND,ND
BR-10,BOSTON MINE TUNNEL OUTLET NR GRASS VALLEY CA,3.91346E+14,12/21/2001,12:10,Environmental,ND,ND,ND,ND,ND,ND,ND,8,79
BR-10,BOSTON MINE TUNNEL OUTLET NR GRASS VALLEY CA,3.91346E+14,2/21/2002,15:10,Environmental,10,6.9,54,10.6,ND,ND,ND,31,80
BR-10,BOSTON MINE TUNNEL OUTLET NR GRASS VALLEY CA,3.91346E+14,12/4/2002,11:10,Environmental,ND,7.7,200,ND,ND,ND,ND,1,40
BR-13,BOSTON MINE LOWER POND SITE 3 NR GRASS VALLEY CA,3.91343E+14,8/27/2002,16:00,Environmental,22.5,8,77,0.9,9,714,11,ND,ND
BR-16,BOSTON MINE WETLANDS POND NR GRASS VALLEY CA,3.91343E+14,12/14/1999,10:30,Environmental,ND,ND,ND,ND,ND,ND,ND,2,62
BR-16,BOSTON MINE WETLANDS POND NR GRASS VALLEY CA,3.91343E+14,5/24/2000,16:30,Environmental,ND,ND,ND,ND,ND,ND,ND,3,ND
BR-18,BOSTON MINE TUNNEL INFLOW A BULKHEAD NR GOLD RUN,3.91346E+14,12/4/2002,13:30,Environmental,ND,ND,ND,ND,ND,ND,ND,5,68
BR-20,BUCKEYE FLAT MINE N DR TO GREENHORN C GRASS VALLEY,3.91446E+14,2/21/2002,15:30,Environmental,10.8,4.8,98,11.8,ND,ND,ND,ND,ND
BR-25,BUCKEYE FLAT MINE UPPER DRAIN TO GREENHORN C,3.91453E+14,4/9/2001,10:00,Environmental,8,5.1,97,ND,ND,ND,ND,ND,ND
BR-25,BUCKEYE FLAT MINE UPPER DRAIN TO GREENHORN C,3.91453E+14,10/18/2001,11:30,Environmental,12,5.1,122,2.9,ND,ND,ND,ND,ND
BR-28,BUCKEYE FLAT MINE DRAIN .06 MI AB GREENHORN C,3.91416E+14,2/21/2002,15:00,Environmental,10.9,6.6,68,12.6,ND,ND,ND,ND,ND
BR-30,GREENHORN C NR HEADWATERS NR SCOTTS FLAT RES,3.91657E+14,2/21/2002,19:40,Environmental,6.7,6.8,20,12.1,3.8,ND,ND,ND,ND
BR-35,GREENHORN C BL GAS CYN NR GRASS VALLEY CA,3.91434E+14,2/21/2002,16:30,Environmental,8.3,6.6,31,13,ND,ND,ND,ND,ND
BR-39,GREENHORN C .2 MI BL THE NARROWS,3.91329E+14,2/21/2002,15:00,Environmental,9.8,ND,ND,11.5,ND,ND,ND,ND,ND
BR-40,GREENHORN C A YOU BET RD BRDG NR NEVADA CITY CA,3.91116E+14,1/22/2002,11:10,Environmental,4.5,7.4,55,12.9,48,705,108,19,52
BR-40,GREENHORN C A YOU BET RD BRDG NR NEVADA CITY CA,3.91116E+14,2/6/2002,11:00,Environmental,4.5,7.3,62,12.7,49,709,106,4,88
BR-40,GREENHORN C A YOU BET RD BRDG NR NEVADA CITY CA,3.91116E+14,2/21/2002,11:00,Environmental,9,6.9,44,10.9,388,714,101,"1,843",28
BR-40,GREENHORN C A YOU BET RD BRDG NR NEVADA CITY CA,3.91116E+14,3/12/2002,13:20,Environmental,9.5,6.8,22,ND,207,703,ND,506,41
BR-40,GREENHORN C A YOU BET RD BRDG NR NEVADA CITY CA,3.91116E+14,4/9/2002,14:00,Environmental,11.5,7.1,49,10.2,64,ND,ND,8,87
BR-40,GREENHORN C A YOU BET RD BRDG NR NEVADA CITY CA,3.91116E+14,5/6/2002,13:20,Environmental,17.5,7.6,57,7.2,39,702,82,10,88
BR-40,GREENHORN C A YOU BET RD BRDG NR NEVADA CITY CA,3.91116E+14,6/17/2002,11:40,Environmental,19.5,6.5,57,9.3,12,707,109,7,79
BR-40,GREENHORN C A YOU BET RD BRDG NR NEVADA CITY CA,3.91116E+14,7/8/2002,13:00,Environmental,24.5,7.2,62,8.3,7.2,718,106,8,83
BR-40,GREENHORN C A YOU BET RD BRDG NR NEVADA CITY CA,3.91116E+14,8/20/2002,13:20,Environmental,22,7.1,63,8.1,2.5,705,100,1,67
BR-40,GREENHORN C A YOU BET RD BRDG NR NEVADA CITY CA,3.91116E+14,9/9/2002,10:00,Environmental,12,6.8,62,8.5,1.8,708,85,1,75
BR-40,GREENHORN C A YOU BET RD BRDG NR NEVADA CITY CA,3.91116E+14,10/17/2002,10:10,Environmental,8.5,5.3,69,13.3,2,695,125,<1,50
BR-40,GREENHORN C A YOU BET RD BRDG NR NEVADA CITY CA,3.91116E+14,11/12/2002,11:00,Environmental,10.5,6.7,78,8.1,17,709,78,64,54
BR-40,GREENHORN C A YOU BET RD BRDG NR NEVADA CITY CA,3.91116E+14,12/18/2002,14:40,Environmental,8.5,7.1,52,9.8,114,703,91,31,100
BR-40,GREENHORN C A YOU BET RD BRDG NR NEVADA CITY CA,3.91116E+14,1/13/2003,13:20,Environmental,ND,ND,ND,ND,209,ND,ND,413,28
BR-40,GREENHORN C A YOU BET RD BRDG NR NEVADA CITY CA,3.91116E+14,2/5/2003,13:20,Environmental,7.5,7.2,59,11.1,44,702,101,6,ND
BR-40,GREENHORN C A YOU BET RD BRDG NR NEVADA CITY CA,3.91116E+14,3/14/2003,14:00,Environmental,12.5,7,55,9.9,108,ND,ND,156,83
BR-40,GREENHORN C A YOU BET RD BRDG NR NEVADA CITY CA,3.91116E+14,3/15/2003,9:30,Environmental,9.5,6,32,10.5,726,696,101,"3,279",49
BR-40,GREENHORN C A YOU BET RD BRDG NR NEVADA CITY CA,3.91116E+14,4/28/2003,13:50,Environmental,10.5,6.8,44,9.7,269,704,94,"1,273",27
BR-40,GREENHORN C A YOU BET RD BRDG NR NEVADA CITY CA,3.91116E+14,5/12/2003,11:30,Environmental,13,7.2,46,10.2,168,714,103,218,68
BR-40,GREENHORN C A YOU BET RD BRDG NR NEVADA CITY CA,3.91116E+14,7/1/2003,7:50,Environmental,13,7.2,63,9.5,14,702,98,3,55
BR-40,GREENHORN C A YOU BET RD BRDG NR NEVADA CITY CA,3.91116E+14,10/14/2003,12:50,Environmental,16.5,7.6,66,9.6,ND,ND,ND,3,78
BR-41,LITTLE GREENHORN C A GREENHORN C,3.91119E+14,2/21/2002,10:50,Environmental,8.7,7.2,48,11.7,ND,ND,ND,ND,ND
BR-45,MISSOURI CYN C 1.2 MI AB GREENHORN C NR CHICAGO PK,3.91259E+14,2/21/2002,17:30,Environmental,9.2,6.8,84,11.6,2.8,ND,ND,ND,ND
BR-50,POORE MINE C BL TUNNEL NR GRASS VALLEY CA,3.91343E+14,2/21/2002,17:20,Environmental,10.6,6.7,48,11.3,ND,ND,ND,ND,ND
BR-51,POORE MINE PIT LAKE NR GRASS VALLEY CA,3.91354E+14,2/6/2002,16:00,Environmental,4.5,4.8,92,7.9,ND,ND,ND,ND,ND
BR-52,POORE MINE TUNNEL EFFLUENT NR GRASS VALLEY CA,3.91347E+14,2/21/2002,17:00,Environmental,12.1,6.8,146,9.7,ND,ND,ND,ND,ND
BR-57,HUNTS HILL DRAIN .03 MI AB GREENHORN C,3.91417E+14,2/21/2002,14:30,Environmental,9.8,6.5,59,11.9,ND,ND,ND,ND,ND
BR-58,GAS CANYON CR .05 MI AB GREENHORN C,3.91437E+14,2/21/2002,16:00,Environmental,9.3,4.7,84,12.8,ND,ND,ND,ND,ND
BR-62,SF GREENHORN C BLW BOSTON MINE NR NEVADA CITY CA,3.91351E+14,12/21/2001,12:40,Environmental,ND,ND,ND,ND,ND,ND,ND,7,94
BR-62,SF GREENHORN C BLW BOSTON MINE NR NEVADA CITY CA,3.91351E+14,2/21/2002,16:00,Environmental,ND,7.5,33,11.2,ND,ND,ND,3,88
BR-64,SAILOR FLAT E TRIB A MOUTH TO GREENHORN C,3.91611E+14,2/21/2002,12:00,Environmental,8.5,7,40,11.5,ND,ND,ND,ND,ND
BR-66,TOM JERRY MINE DR A TUNNEL OUTLET NR NEVADA CITY,3.91627E+14,7/30/2002,17:40,Environmental,15.5,6,81,5.8,ND,681,65,ND,ND
BR-73,STARR MINE TUNNEL OUTLET NR GRASS VALLEY CA,3.9133E+14,2/21/2002,16:20,Environmental,11.8,7.4,163,10.6,ND,ND,ND,ND,ND
BR-76,POLAR STAR MINE TUNNEL INLET NR DUTCH FLAT CA,3.91243E+14,5/7/1999,12:00,Environmental,ND,6.3,352,ND,ND,ND,ND,114,ND
BR-77,POLAR STAR MINE TUNNEL MIDWAY NR DUTCH FLAT CA,3.91245E+14,5/7/1999,10:30,Environmental,ND,6.3,351,ND,ND,ND,ND,ND,ND
BR-78,POLAR STAR MINE TUNNEL DISCHARGE NR DUTCH FLAT CA,3.91247E+14,5/7/1999,9:30,Environmental,ND,6.1,354,ND,ND,ND,ND,114,ND
BR-78,POLAR STAR MINE TUNNEL DISCHARGE NR DUTCH FLAT CA,3.91247E+14,5/27/1999,10:30,Environmental,12,6.4,517,ND,ND,ND,ND,ND,ND
BR-78,POLAR STAR MINE TUNNEL DISCHARGE NR DUTCH FLAT CA,3.91247E+14,2/13/2001,10:20,Environmental,ND,7.9,735,ND,ND,ND,ND,29,ND
BR-78,POLAR STAR MINE TUNNEL DISCHARGE NR DUTCH FLAT CA,3.91247E+14,11/6/2001,10:30,Environmental,8.5,7.6,67,ND,ND,ND,10,<1,50
BR-78,POLAR STAR MINE TUNNEL DISCHARGE NR DUTCH FLAT CA,3.91247E+14,12/21/2001,9:00,Environmental,7,5.7,350,10.3,ND,ND,100,2,94
BR-79,POLAR STAR MINE BORROW PIT NR DUTCH FLAT CA,3.9125E+14,8/3/2000,15:30,Environmental,ND,3,ND,ND,ND,ND,ND,ND,ND
BR-80,NF STEEPHOLLOW C NR BLUE CYN CA,3.91642E+14,7/1/1999,10:00,Environmental,ND,7,63,ND,ND,ND,ND,ND,ND
BR-81,REMINGTON HILL MINE MAIN DISCHARGE NR BLUE CYN CA,3.91643E+14,7/1/1999,9:30,Environmental,ND,6.7,90,ND,ND,ND,ND,ND,ND
BR-82,SE TRIB TO ROLLINS RES NR COLFAX CA,3.90815E+14,12/21/2001,7:30,Environmental,7.5,6.7,106,9.6,ND,706,86,ND,ND
BR-83,POORMAN C AB ROLLINS RES A YOU BET RD NR COLFAX CA,3.90951E+14,12/21/2001,14:30,Environmental,7.5,6.5,ND,9.3,ND,703,ND,ND,ND
BR-84,S TRIB TO ROLLINS RES NR COLFAX CA,3.90753E+14,12/21/2001,8:00,Environmental,8.5,6.6,89,8.9,ND,ND,ND,ND,ND
BR-85,BEAR R BL STEEPHOLLOW C NR CHICAGO PARK CA,3.91023E+14,1/26/2000,13:00,Environmental,8,6.8,55,ND,ND,ND,ND,ND,ND
BR-86,NW TRIB TO ROLLINS RES NR BEAR RIVER PINES CA,3.91006E+14,12/21/2001,12:30,Environmental,7,7,86,10,ND,ND,ND,ND,ND
BR-89,SOUTHERN CROSS MINE TUNNEL MIDWAY NR DUTCH FLAT CA,3.91237E+14,5/27/1999,15:00,Environmental,13,6.1,384,ND,ND,ND,ND,ND,ND
BR-91,STEEPHOLLOW C A LOWELL HILL BRDG NR NEVADA CITY CA,3.91146E+14,1/26/2000,10:00,Environmental,8,6.8,52,ND,ND,ND,ND,ND,ND
BR-93,STUMP CYN C NE NR DUTCH FLAT CA,3.91351E+14,2/16/2000,12:45,Environmental,7,6.1,33,ND,ND,ND,ND,ND,ND
BR-94,STUMP CYN C NW NR DUTCH FLAT CA,3.9135E+14,2/16/2000,13:45,Environmental,7,6.9,26,ND,ND,ND,ND,ND,ND
BR-95,YOU BET MINE OUTLET TO MAIN DRAIN TNNL NR GOLD RUN,3.91215E+14,5/6/1999,12:30,Environmental,ND,3.7,478,ND,ND,ND,ND,ND,ND
BR-96,YOU BET MINE INLET TO MAIN DRAIN TNNL NR GOLD RUN,3.91223E+14,5/6/1999,15:00,Environmental,ND,3.5,525,ND,ND,ND,ND,ND,ND
BR-99,YOU BET MINE SW DRAINAGE TUNNEL NR GOLD RUN CA,3.91144E+14,5/5/1999,14:30,Environmental,ND,4.5,173,ND,ND,ND,ND,ND,ND
BR-100,YOU BET SOUTH WEST-3 TUNNEL NR GOLD RUN CA,3.91147E+14,2/6/2002,10:30,Environmental,12,5.9,252,4.6,ND,ND,ND,ND,ND
BR-101,WALLOUPA MINE SOUTH DRAINAGE TUNNEL NR GOLD RUN CA,3.91132E+14,2/6/2002,12:30,Environmental,7.9,7.5,120,11.5,ND,ND,ND,ND,ND
BR-102,WALLOUPA MINE EAST DRAINAGE TUNNEL NR GOLD RUN CA,3.91144E+14,5/5/1999,15:20,Environmental,10,6.4,168,10,ND,ND,ND,ND,ND
DC-02,DEER C AB SCOTTS FLAT RES NR NEVADA CITY CA,3.91731E+14,1/27/2000,10:00,Environmental,6,6.8,32,ND,ND,ND,ND,3,59
DC-03,DEER C BL SCOTTS FLAT RES NR NEVADA CITY CA,3.91617E+14,1/27/2000,13:30,Environmental,ND,6.6,36,ND,ND,ND,ND,6,83
DC-05,DEER C BL DEER C FALLS NR ROUGH AND READY CA,3.9144E+14,8/24/2000,10:00,Environmental,17,ND,ND,ND,ND,ND,ND,ND,ND
DC-08,UNNAMED TRIB TO DEER C A SCOTTS FLAT RES BL CASCI,3.91728E+14,1/27/2000,11:00,Environmental,7,6.8,56,ND,ND,ND,ND,4,81
LY-04,YUBA R NR SMARTSVILLE CA,11419600,12/11/2002,11:00,Environmental,10,7.6,78,7.3,ND,763,65,2,71
LY-05,YUBA R A DAQUERRA PT NR BROWNS VALLEY CA,11420800,8/28/2001,15:00,Environmental,18,ND,ND,ND,ND,ND,ND,ND,ND
LY-05,YUBA R A DAQUERRA PT NR BROWNS VALLEY CA,11420800,12/10/2002,11:40,Environmental,11,7.7,79,7.7,ND,762,70,ND,ND
LY-08,YUBA R A MARYSVILLE CA,11421500,12/11/2002,10:00,Environmental,ND,ND,ND,ND,ND,ND,ND,1,83
LY-11,WETLANDS POND NE OF S POND IN YUBA GOLDFIELDS,3.913E+14,7/17/2003,15:20,Environmental,29,7.7,77,9.1,ND,ND,ND,17,72
LY-12,LARGE POND E OF BIG SEEP IN YUBA GOLDFIELDS,3.91304E+14,7/22/2003,11:40,Environmental,16.5,7.5,80,10.4,ND,759,107,2,85
LY-13,LARGE POND W OF WETLANDS POND IN YUBA GOLDFIELDS,3.91258E+14,7/22/2003,13:10,Environmental,20.5,7.2,97,9.9,ND,759,110,1,62
LY-14,BIG SEEP SECTION 27 IN YUBA GOLDFIELDS,3.91305E+14,7/17/2003,14:20,Environmental,14,7.5,74,9.5,ND,ND,ND,ND,ND
LY-15,T POND OUTLET IN YUBA GOLDFIELDS NR HAMMONTON CA,3.9125E+14,7/17/2003,15:50,Environmental,15.5,7.5,75,9.6,ND,ND,ND,2,95
LY-16,T POND IN YUBA GOLDFIELDS NR HAMMONTON CA,3.91259E+14,7/17/2003,13:00,Environmental,16,7.5,75,9.1,ND,ND,ND,ND,ND
MY-01,M YUBA R BL MILTON DAM CA,11408550,10/28/2002,12:00,Environmental,ND,ND,ND,ND,ND,ND,ND,2,78
MY-01,M YUBA R BL MILTON DAM CA,11408550,6/10/2003,10:30,Environmental,ND,ND,ND,ND,ND,ND,ND,2,79
MY-02,M YUBA R NR ALLEGHANY CA,11408700,11/1/2002,12:20,Environmental,6.5,8,126,6.8,ND,682,62,2,47
MY-03,M YUBA R NR CAMPTONVILLE CA,11408850,11/4/2002,12:50,Environmental,6,8.1,148,13.2,ND,702,115,3,75
MY-04,M YUBA R NR NORTH SAN JUAN CA,11410000,6/20/2001,10:30,Environmental,18,8,93,ND,ND,ND,ND,ND,ND
MY-04,M YUBA R NR NORTH SAN JUAN CA,11410000,10/21/2002,13:00,Environmental,12,7.8,142,7.2,ND,725,70,ND,ND
MY-05,CLEAR C NR NORTH SAN JUAN CA,3.92256E+14,4/28/2004,10:30,Environmental,12.4,8,80,10.2,0.03,720,101,ND,ND
MY-06,SWEETLAND C AT SWEETLAND CA,3.92036E+14,4/27/2004,10:20,Environmental,13.2,6.4,83,10.7,0.01,720,108,ND,ND
MY-07,M YUBA R AB COLGATE PH NR FRENCH CORRAL CA,3.9195E+14,10/25/2002,10:50,Environmental,12,7.9,148,5.9,ND,742,56,ND,ND
SY-01,OMEGA EAST SHAFT (TUNNEL VENT SHAFT) NR WASHINGTON,3.92022E+14,4/30/1999,13:20,Environmental,ND,5.7,40,ND,ND,ND,ND,ND,ND
SY-03,OMEGA SOUTH TUNNEL NR WASHINGTON CA,3.9202E+14,4/30/1999,12:30,Environmental,ND,5.3,30,ND,ND,ND,ND,ND,ND
SY-04,OMEGA DR GULCH A SCOTCHMAN C NR WASHINGTON CA,3.92045E+14,6/8/1999,13:30,Environmental,ND,6.2,66,ND,2.2,ND,ND,ND,ND
SY-05,SCOTCHMAN C AB OMEGA DR GULCH NR WASHINGTON CA,3.92042E+14,6/8/1999,14:30,Environmental,ND,6.4,44,ND,2,ND,ND,ND,ND
SY-06,ALPHA MINE RED TUNNEL NR WASHINGTON,3.92023E+14,12/16/1999,11:20,Environmental,10,5.5,20,ND,ND,ND,ND,ND,ND
SY-07,ALPHA MINE MAIN DRAINAGE N ALPHA DIG NR WASHINGTON,3.92108E+14,6/20/2000,13:30,Environmental,14,ND,ND,ND,ND,ND,ND,ND,ND
SY-08,SCOTCHMAN C A THE FALLS NR WASHINGTON CA,3.92116E+14,7/29/2002,15:40,Environmental,19.5,6.9,57,6.3,1.1,ND,ND,ND,ND
SY-10,SCOTCHMAN C BL FALLS NR WASHINGTON CA,3.92119E+14,6/20/2000,14:00,Environmental,ND,ND,ND,ND,ND,ND,ND,3,69
SY-10,SCOTCHMAN C BL FALLS NR WASHINGTON CA,3.92119E+14,7/29/2002,14:30,Environmental,19,7,57,7.3,ND,ND,ND,1,83
SY-11,ALPHA MINE PIT NR WASHINGTON CA,3.92015E+14,12/16/1999,10:30,Environmental,8,5.1,64,ND,ND,ND,ND,ND,ND
SY-13,ALPHA MINE PIT LK NR WASHINGTON CA,3.92007E+14,8/23/2000,14:50,Environmental,23,5.5,ND,ND,ND,ND,ND,2,ND
SY-13,ALPHA MINE PIT LK NR WASHINGTON CA,3.92007E+14,7/29/2002,11:10,Environmental,26,7.4,6,6.7,ND,763,83,8,48
SY-15,ANCHO ERIE DRAINAGE A POORMAN C NR WASHINGTON CA,3.92512E+14,7/31/2002,11:40,Environmental,15,7.2,50,ND,ND,672,ND,ND,ND
SY-16,POORMAN C BL ANCHO ERIE MINE DRAIN NR WASHINGTON,3.92513E+14,7/31/2002,12:00,Environmental,10,7.5,122,11,ND,669,111,4,78
SY-17,GRIZZLY HILL TUNNEL OUTLET NR NORTH BLOOMFIELD CA,3.92014E+14,3/16/2003,11:30,Environmental,ND,ND,ND,ND,ND,ND,ND,2,85
SY-19,LE DU MINE TUNNEL DISCHARGE,3.92151E+14,2/5/2002,12:00,Environmental,3.4,4.3,51,12.6,ND,ND,ND,ND,ND
SY-20,CRYSTAL HILL MINE POND NR NORTH BLOOMFIELD CA,3.92159E+14,2/5/2002,15:00,Environmental,6.4,3.1,18,10.5,ND,ND,ND,ND,ND
SY-21,MALAKOFF DIGGINGS FLD GREEN SHAFT DISCH NR BLMFLD,3.92152E+14,4/28/1999,16:30,Environmental,ND,6.3,393,ND,ND,668,ND,52,ND
SY-22,MALAKOFF DIGGINGS FLOODED RED SHAFT NR N BLMFLD,3.92155E+14,4/28/1999,16:00,Environmental,ND,5.8,600,ND,ND,668,ND,ND,ND
SY-22,MALAKOFF DIGGINGS FLOODED RED SHAFT NR N BLMFLD,3.92155E+14,12/1/1999,14:20,Environmental,ND,6.5,450,ND,ND,ND,ND,ND,ND
SY-23,MALAKOFF DIGGINGS HILLER TNNL DISCH N BLOOMFIELD,3.92204E+14,12/1/1999,12:20,Environmental,ND,7.4,167,ND,ND,ND,ND,236,100
SY-24,MALAKOFF DIGGINGS POND NR NORTH BLOOMFIELD CA,3.92201E+14,12/1/1999,11:00,Environmental,ND,6.3,13,ND,ND,ND,ND,6,92
SY-25,MALAKOFF DIGGINGS LK CITY TNNL DISCH NR N BLMFLD,3.92111E+14,7/7/1999,13:00,Environmental,ND,7.6,136,ND,ND,ND,ND,ND,ND
SY-27,MALAKOFF DIGGINGS N BLMFLD TNNL DISCH NR N BLMFLD,3.92051E+14,7/7/1999,11:30,Environmental,ND,7.3,348,ND,ND,ND,ND,ND,ND
SY-29,RELIEF HILL DEEP BLUE TNNL OUTFLOW NR N BLOOMFIELD,3.92126E+14,5/20/1999,12:00,Environmental,ND,5.6,485,ND,ND,ND,ND,ND,ND
SY-30,RELIEF HILL HYDR PIT MINE DR TNNL NR N BLOOMFIELD,3.92111E+14,9/1/1999,12:00,Environmental,15,3.8,455,ND,ND,ND,ND,ND,ND
SY-30,RELIEF HILL HYDR PIT MINE DR TNNL NR N BLOOMFIELD,3.92111E+14,7/30/2002,13:00,Environmental,17.5,3.9,362,8.6,ND,673,102,ND,ND
SY-32,RELIEF HILL POND NR RELIEF HILL CA,3.92119E+14,7/30/2002,11:00,Environmental,25.5,3.8,280,6.9,ND,764,84,ND,ND
SY-32,RELIEF HILL POND NR RELIEF HILL CA,3.92119E+14,7/30/2002,15:00,Environmental,ND,4,344,ND,ND,ND,ND,ND,ND
SY-33,LITTLE ROCK C .05 MI BL BLUE TENT RD NR NEVADA CTY,3.91726E+14,7/8/2003,13:00,Environmental,14,6.8,75,7.9,0.14,691,85,ND,ND
SY-34,LITTLE ROCK C .1 MI BL BLUE TENT RD NR NEVADA CITY,3.91727E+14,7/8/2003,12:10,Environmental,14,7,74,8.5,0.14,692,91,ND,ND
SY-35,LITTLE ROCK C .2 MI BL BLUE TENT RD NR NEVADA CITY,3.91728E+14,7/8/2003,11:10,Environmental,13,6.7,76,7.6,0.2,690,80,ND,ND
SY-36,LITTLE ROCK C .9 MI BL BLUE TENT RD NR NEVADA CITY,3.91742E+14,7/12/2003,10:40,Environmental,13.5,7.2,83,9.3,0.25,697,98,ND,ND
SY-38,ROCK C AB LITTLE ROCK C NR NEVADA CITY CA,3.91756E+14,7/12/2003,12:30,Environmental,7.5,ND,39,9.5,1.6,700,86,ND,ND
SY-39,ROCK C A ROCK C RD NR NEVADA CITY CA,3.9181E+14,7/10/2003,12:40,Environmental,16.5,7.5,46,9.4,3,698,105,ND,ND
SY-40,LAKE VERA ROCK C ARM NR NEVADA CITY CA,3.91803E+14,6/26/2003,15:00,Environmental,24,7.6,52,8.9,ND,ND,ND,ND,ND
SY-41,LAKE VERA IN THALWEG NR DAM NR NEVADA CITY CA,3.91807E+14,6/26/2003,14:30,Environmental,21.1,7.6,53,9.4,ND,ND,ND,ND,ND
SY-42,LAKE VERA S SHORE NR NEVADA CITY CA,3.91802E+14,6/26/2003,15:30,Environmental,23.5,7.6,52,9.3,ND,ND,ND,ND,ND
SY-44,S YUBA R AB LANGS CROSSING NR EMIGRANT GAP CA,3.91911E+14,10/31/2002,10:20,Environmental,9.5,7.1,49,9,ND,644,93,<1,50
SY-44,S YUBA R AB LANGS CROSSING NR EMIGRANT GAP CA,3.91911E+14,6/11/2003,10:40,Environmental,13.5,7.4,23,9.3,ND,653,104,2,90
SY-45,S YUBA R BL POORMAN C NR WASHINGTON CA,3.92119E+14,11/5/2002,14:10,Environmental,7.5,7.5,87,5.5,ND,700,50,8,99
SY-46,S YUBA R A MISSOURI BAR NR NEVADA CITY CA,3.92025E+14,10/29/2002,11:00,Environmental,9.5,7.5,93,16.8,33,699,160,2,79
SY-47,S YUBA R A EDWARDS CROSSING NR NEVADA CITY CA,3.91949E+14,1/28/2000,11:00,Environmental,5,7.2,63,ND,437,ND,ND,4,68
SY-48,S YUBA R AB PURDON CROSSING NR NEVADA CITY CA,3.91938E+14,10/21/2002,11:00,Environmental,11,7,96,8.6,ND,ND,ND,2,92
SY-50,S YUBA R A BRIDGEPORT CA,3.91734E+14,10/23/2002,13:50,Environmental,13.5,7.7,112,12.6,ND,752,123,2,69
SY-52,BLUE HOLE LK A SAILOR FLAT MINE NR NEVADA CITY CA,3.91937E+14,8/24/1999,11:00,Environmental,ND,3.5,296,ND,ND,ND,ND,ND,ND
SY-54,SHADY C NR NORTH SAN JUAN CA,3.91922E+14,2/26/2004,14:40,Environmental,7.6,6.7,49,11.9,ND,713,106,ND,ND
SY-56,BIRCHVILLE POND NR FRENCH CORRAL CA,3.91937E+14,2/5/2002,16:30,Environmental,7.5,6.6,34,12,ND,ND,ND,ND,ND
SY-57,FRENCH CORRAL C NR BRIDGEPORT CA,3.91744E+14,4/29/2004,12:30,Environmental,15.7,7.4,225,10.1,0.02,ND,ND,ND,ND
SY-58,KENTUCKY RAVINE NR FRENCH CORRAL CA,3.91726E+14,4/29/2004,13:50,Environmental,15.4,8.1,248,11.2,1.6,750,114,ND,ND
TR-01,EF TRINITY R A HORSE HEAVEN MDW NR MT SHASTA CA,4.10928E+14,6/5/2001,12:15,Environmental,10.6,6.5,42,ND,ND,ND,ND,14,ND
TR-01,EF TRINITY R A HORSE HEAVEN MDW NR MT SHASTA CA,4.10928E+14,8/13/2002,12:30,Environmental,12,6.7,80,7.1,ND,ND,ND,1,60
TR-02,TAMARACK C A EF TRINITY R NR MT SHASTA CA,4.10916E+14,6/5/2001,13:00,Environmental,10.5,7.4,54,ND,ND,ND,ND,5,ND
TR-02,TAMARACK C A EF TRINITY R NR MT SHASTA CA,4.10916E+14,8/13/2002,13:00,Environmental,18,7.9,105,9.1,ND,637,115,<1,50
TR-03,CROW C AB CONFLUENCE OF EF TRINITY R NR TRINITY CE,4.1074E+14,6/5/2001,14:00,Environmental,14.5,8.3,190,ND,ND,ND,ND,5,ND
TR-03,CROW C AB CONFLUENCE OF EF TRINITY R NR TRINITY CE,4.1074E+14,8/13/2002,11:00,Environmental,16.5,7.6,260,8.1,ND,664,95,1,20
TR-05,ALTOONA MINE DR A EF TRINITY R NR TRINITY CENTER,4.10734E+14,6/5/2001,15:00,Environmental,ND,ND,ND,ND,ND,ND,ND,16,ND
TR-05,ALTOONA MINE DR A EF TRINITY R NR TRINITY CENTER,4.10734E+14,8/13/2002,14:00,Environmental,29,8.9,2250,7.7,ND,ND,ND,3,11
TR-06,EF TRINITY R BL ALTOONA MINE DR NR TRINITY CENTER,4.10731E+14,6/5/2001,15:30,Environmental,15.3,8.1,180,ND,ND,ND,ND,11,ND
TR-06,EF TRINITY R BL ALTOONA MINE DR NR TRINITY CENTER,4.10731E+14,8/13/2002,10:30,Environmental,19,8.4,421,8.6,ND,673,105,<1,67
TR-08,EF TRINITY R 1.2 MI BL DEVILS C NR TRINITY CENTER,4.10259E+14,6/5/2001,18:30,Environmental,15.2,8,126,ND,ND,ND,ND,11,ND
TR-08,EF TRINITY R 1.2 MI BL DEVILS C NR TRINITY CENTER,4.10259E+14,8/12/2002,13:00,Environmental,21.1,8.4,266,8.7,ND,697,107,<1,67
TR-09,EF TRINITY R BL COUNTY RD 106 NR TRINITY CENTER CA,4.10031E+14,6/5/2001,17:30,Environmental,18,8,136,ND,ND,ND,ND,6,ND
TR-09,EF TRINITY R BL COUNTY RD 106 NR TRINITY CENTER CA,4.10031E+14,8/12/2002,10:00,Environmental,18.5,7.7,251,8.2,ND,700,96,<1,67
TR-11,TRINITY R A BIG FLAT DAY USE AREA NR BIG BAR CA,4.04427E+14,8/27/2002,14:20,Environmental,16.5,8.2,106,1.2,ND,733,13,ND,ND
TR-14,EF OF NF TRINITY R .53 MI AB BARNEY GULCH,4.0494E+14,8/27/2002,12:00,Environmental,17,8,161,2.3,ND,719,25,ND,ND
TR-15,NEW R A DENNY CAMPGROUND NR DENNY CA,4.05557E+14,8/26/2002,15:20,Environmental,19.5,8,204,4.8,29,731,55,ND,ND
BR-75,POLAR STAR MINE PIT SUMP NR DUTCH FLAT CA,3.91245E+14,8/3/2000,13:40,Environmental Disturbed,25,11,1290,ND,ND,ND,ND,ND,ND
